Date,Time,Presenter,Moderator,Title,Paper,Registration
8/11/2021,2:30 PM EDT,"Maggie Shi, Ernest Dorilas",Sarah Miller,Graduate Student Presentations,pdfs/Dorilas.pdf,https://umn.zoom.us/meeting/register/tJcqdOGsrz0sGNzjGjoTRJnSUJdypW2h5BHr
9/15/2021,2:30 PM EDT,"Daniel Guth, Mayra Pineda-Torres",Kitt Carpenter,Graduate Student Presentations,,https://umn.zoom.us/meeting/register/tJArcOygpjkiHd2i3n-24mcAwJXz0XPYrXEZ
9/29/2021,2:30 PM EDT,Rena Conti,Abby Alpert,,,https://umn.zoom.us/meeting/register/tJctceyvqjosHNLLK_WPxqYkJcx3Oon4j9Hl
10/20/2021,2:30 PM EDT,Carolina Arteaga,Ezra Golberstein,The Opioid Epidemic:  Causes and Consequences,,https://umn.zoom.us/meeting/register/tJIvdeGtrj0tE9Kvy38fqJl6IuHXGtdYcZeo
11/10/2021,2:30 PM EDT,Marit Hinnosaar,Shooshan Danagoulian,Malleability of Alcohol Consumption:  Evidence from Migrants,,https://umn.zoom.us/meeting/register/tJEodO6trz8jGNQzSSfx4S5YEIFkcK2nlZps
12/1/2021,2:30 PM EDT,Conor Lennon,David Slusky,Employer Sponsored Health Insurance and Labor Market Outcomes for Gay Men:  Evidence from the Advent of Pre-Exposure Prophylaxis,,https://umn.zoom.us/meeting/register/tJUtcOugrTgvHNSNy5gF-XiSOZMIUJ56ebKH
12/22/2021,2:30 PM EDT,Christopher Whaley,Sayeh Nikpay,Who Pays for Health Care Costs? The Effects of Health Care Prices on Wages,,https://umn.zoom.us/meeting/register/tJ0vce6rqDopH9EqN6oeYbPIE15-Ji0hNwt_
